<?xml version="1.0" encoding="UTF-8"?>
<epx:canvas xmlns:epx="http://www.pathwayeditor.org/Exchange"
    xmlns:xsi="http://www.w3.org/2001/XMLSchema-instance"
    xsi:schemaLocation="http://www.pathwayeditor.org/Exchange file:/Users/smoodie/sfworkspace/BusinessObjects/schema/Canvas.xsd"
    name="Diagram name" lastCreationSerial="44">
    <Grid snapToGrid="true" gridOn="true">
        <GridSize width="10.0" height="10.0"/>
    </Grid>
    <Notation qualifiedName="org.pathwayeditor.stub.notation" majorVersion="99" minorVersion="19"
        patchVersion="9" displayName="Stub Notation">
        <Description>Stub notation description</Description>
        <ObjectType uniqueId="0" name="Root Object Type" classification="Root">
            <description>Root Object Type Description</description>
        </ObjectType>
        <ObjectType uniqueId="3" name="Shape C" classification="Shape">
            <description>Shape C Test ObjectType</description>
        </ObjectType>
        <ObjectType uniqueId="5" name="Link A" classification="Link">
            <description>Link A Object Type</description>
        </ObjectType>
        <ObjectType uniqueId="6" name="Link B" classification="Link">
            <description>Link B Object Type</description>
        </ObjectType>
        <ObjectType uniqueId="8" name="Link D" classification="Link">
            <description>Link D Object Type</description>
        </ObjectType>
        <ObjectType uniqueId="2" name="Shape B" classification="Shape">
            <description>Shape B Test ObjectType</description>
        </ObjectType>
        <ObjectType uniqueId="1" name="Shape A" classification="Shape">
            <description>Shape A Test ObjectType</description>
        </ObjectType>
        <ObjectType uniqueId="7" name="Link C" classification="Link">
            <description>Link C Object Type</description>
        </ObjectType>
        <ObjectType uniqueId="4" name="Shape D" classification="Shape">
            <description>Shape D Test ObjectType</description>
        </ObjectType>
    </Notation>
    <CanvasSize width="10.0" height="10.0"/>
    <Background red="100" green="100" blue="100"/>
    <Model lastNodeIndex="16" lastEdgeIndex="8">
        <RootNode nodeId="0">
            <SubModel>
                <ShapeNode nodeId="1">
                    <SubModel>
                        <ShapeNode nodeId="3">
                            <SubModel>
                                <LabelNode nodeId="15">
                                    <SubModel/>
                                    <LabelAttribute creationSerial="24" lineStyle="SOLID"
                                        lineWidth="1.0" noFill="true" noBorder="true">
                                        <Location x="57.0" y="57.0"/>
                                        <Size width="57.0" height="57.0"/>
                                        <LineColour red="255" green="255" blue="255"/>
                                        <FillColour red="107" green="107" blue="107"/>
                                        <PropertyRef id="2"/>
                                    </LabelAttribute>
                                </LabelNode>
                            </SubModel>
                            <ShapeAttribute creationSerial="3" objectTypeId="4" lineWidth="3.0"
                                lineStyle="DASH_DOT">
                                <Location x="53.0" y="53.0"/>
                                <Size width="53.0" height="53.0"/>
                                <FillColour red="103" green="103" blue="103"/>
                                <LineColour red="103" green="103" blue="103"/>
                                <PropertyRef id="2"/>
                                <FigureDefinition>curbounds rect</FigureDefinition>
                            </ShapeAttribute>
                        </ShapeNode>
                        <ShapeNode nodeId="4">
                            <SubModel>
                                <LabelNode nodeId="16">
                                    <SubModel/>
                                    <LabelAttribute creationSerial="25" lineStyle="SOLID"
                                        lineWidth="1.0" noFill="true" noBorder="true">
                                        <Location x="58.0" y="58.0"/>
                                        <Size width="58.0" height="58.0"/>
                                        <LineColour red="255" green="255" blue="255"/>
                                        <FillColour red="108" green="108" blue="108"/>
                                        <PropertyRef id="3"/>
                                    </LabelAttribute>
                                </LabelNode>
                            </SubModel>
                            <ShapeAttribute creationSerial="4" objectTypeId="3" lineWidth="4.0"
                                lineStyle="DASH_DOT_DOT">
                                <Location x="54.0" y="54.0"/>
                                <Size width="54.0" height="54.0"/>
                                <FillColour red="104" green="104" blue="104"/>
                                <LineColour red="104" green="104" blue="104"/>
                                <PropertyRef id="3"/>
                                <FigureDefinition>curbounds rect</FigureDefinition>
                            </ShapeAttribute>
                        </ShapeNode>
                        <LabelNode nodeId="9">
                            <SubModel/>
                            <LabelAttribute creationSerial="18" lineStyle="SOLID" lineWidth="1.0"
                                noFill="true" noBorder="true">
                                <Location x="51.0" y="51.0"/>
                                <Size width="51.0" height="51.0"/>
                                <LineColour red="255" green="255" blue="255"/>
                                <FillColour red="101" green="101" blue="101"/>
                                <PropertyRef id="1"/>
                            </LabelAttribute>
                        </LabelNode>
                        <LinkEdge linkIdx="7" srcNodeIdx="1" tgtNodeIdx="1">
                            <LinkAttribute creationSerial="16" lineStyle="DASH_DOT" lineWidth="18.0"
                                objectTypeId="5" lastBendPointIndex="0">
                                <LineColour red="108" green="108" blue="108"/>
                                <srcTerminus creationSerial="40" gap="15.0"
                                    endDecoratorType="DIAMOND">
                                    <Location x="0.0" y="0.0"/>
                                    <DecoratorSize width="25.0" height="25.0"/>
                                    <PropertyRef id="5"/>
                                </srcTerminus>
                                <tgtTerminus creationSerial="41" gap="16.0" endDecoratorType="ARROW">
                                    <Location x="0.0" y="0.0"/>
                                    <DecoratorSize width="26.0" height="26.0"/>
                                    <PropertyRef id="6"/>
                                </tgtTerminus>
                                <PropertyRef id="4"/>
                            </LinkAttribute>
                        </LinkEdge>
                        <LinkEdge linkIdx="8" srcNodeIdx="1" tgtNodeIdx="1">
                            <LinkAttribute creationSerial="17" lineStyle="DASH_DOT_DOT"
                                lineWidth="19.0" objectTypeId="5" lastBendPointIndex="0">
                                <LineColour red="109" green="109" blue="109"/>
                                <srcTerminus creationSerial="42" gap="17.0"
                                    endDecoratorType="DIAMOND">
                                    <Location x="0.0" y="0.0"/>
                                    <DecoratorSize width="27.0" height="27.0"/>
                                    <PropertyRef id="8"/>
                                </srcTerminus>
                                <tgtTerminus creationSerial="43" gap="18.0" endDecoratorType="ARROW">
                                    <Location x="0.0" y="0.0"/>
                                    <DecoratorSize width="28.0" height="28.0"/>
                                    <PropertyRef id="9"/>
                                </tgtTerminus>
                                <PropertyRef id="7"/>
                            </LinkAttribute>
                        </LinkEdge>
                    </SubModel>
                    <ShapeAttribute creationSerial="1" objectTypeId="1" lineWidth="1.0"
                        lineStyle="SOLID">
                        <Location x="51.0" y="51.0"/>
                        <Size width="51.0" height="51.0"/>
                        <FillColour red="101" green="101" blue="101"/>
                        <LineColour red="101" green="101" blue="101"/>
                        <PropertyRef id="1"/>
                        <FigureDefinition>curbounds rect</FigureDefinition>
                    </ShapeAttribute>
                </ShapeNode>
                <ShapeNode nodeId="2">
                    <SubModel>
                        <ShapeNode nodeId="5">
                            <SubModel/>
                            <ShapeAttribute creationSerial="5" objectTypeId="3" lineWidth="5.0"
                                lineStyle="DOT">
                                <Location x="55.0" y="55.0"/>
                                <Size width="55.0" height="55.0"/>
                                <FillColour red="105" green="105" blue="105"/>
                                <LineColour red="105" green="105" blue="105"/>
                                <PropertyRef id="11"/>
                                <FigureDefinition>curbounds rect</FigureDefinition>
                            </ShapeAttribute>
                        </ShapeNode>
                        <ShapeNode nodeId="6">